{
  "$schema": "https://json-schema.org/draft/2020-12/schema",
  "$id": "https://mandate.dev/schemas/engine-params.schema.json",
  "title": "EngineParams",
  "description": "Consolidated engine-tunable knobs. Sections are added by each implementing SPEC (tick, fog, credibility, committee). Content-only — no engine logic here.",
  "type": "object",
  "additionalProperties": false,
  "properties": {
    "tick": {
      "type": "object",
      "additionalProperties": false,
      "required": ["history_size"],
      "properties": {
        "history_size": {
          "type": "integer",
          "minimum": 1,
          "description": "Maximum number of prior snapshots retained in state.history. Default 24 (two years of monthly ticks)."
        }
      }
    },
    "fog": {
      "type": "object",
      "description": "Per-series fog parameters. Populated by SPEC-FOG-1.",
      "additionalProperties": {
        "type": "object",
        "additionalProperties": false,
        "required": ["noise_scale", "lag_months"],
        "properties": {
          "noise_scale": {
            "type": "number",
            "minimum": 0,
            "description": "Standard deviation of Gaussian noise added to the observed value."
          },
          "lag_months": {
            "type": "integer",
            "minimum": 0,
            "description": "How many months behind current state the observation is drawn from. 0 = current."
          }
        }
      }
    },
    "credibility": {
      "type": "object",
      "description": "Credibility spiral parameters. Populated by SPEC-CRED-4.",
      "additionalProperties": true
    },
    "committee": {
      "type": "object",
      "description": "FOMC committee parameters. Populated by SPEC-COMM-2.",
      "additionalProperties": true
    }
  }
}
